{
  "$schema": "https://tinyzkp.com/schemas/tinyzkp-trust-center.schema.json",
  "name": "TinyZKP Trust Center",
  "url": "https://tinyzkp.com/trust",
  "generated_at": "2026-06-24",
  "summary": "Security, privacy, status, proof-scope, API-contract, and procurement review metadata for TinyZKP.",
  "product_scope": {
    "live_default_product": "Transparent STARK state-transition proof receipts",
    "primary_template": "accumulator_step",
    "verification": "Free public verification via first-party WASM where compatible, with hosted fallback for current production proof formats.",
    "not_claimed_by_default": [
      "Generic private-input zero knowledge",
      "General zkVM availability",
      "Finished zkML service",
      "On-chain verifier support for every chain",
      "Off-chain business truth not encoded into the statement"
    ]
  },
  "security_status": {
    "external_cryptography_audit": "pending",
    "soc2": "not_certified",
    "iso27001": "not_certified",
    "responsible_disclosure_email": "logan@tinyzkp.com",
    "security_txt": "https://tinyzkp.com/.well-known/security.txt"
  },
  "data_handling": {
    "prove_api": "Receives template name, public parameters, account metadata, job metadata, and operational logs needed to run hosted proving.",
    "verify_api": "Receives proof object when hosted verification is used. Local WASM verification avoids sending proof bytes for compatible formats.",
    "website_analytics": "Low-cardinality product events. Analytics events do not include proof bytes, API keys, email addresses, or form contents.",
    "support": "Information submitted through contact forms or email. Do not send API keys, private inputs, customer records, or secrets."
  },
  "review_links": {
    "trust_center": "https://tinyzkp.com/trust",
    "security_review_packet": "https://tinyzkp.com/security-review",
    "security_status": "https://tinyzkp.com/security",
    "status_page": "https://tinyzkp.com/status",
    "use_cases": "https://tinyzkp.com/use-cases",
    "compare": "https://tinyzkp.com/compare",
    "examples": "https://tinyzkp.com/examples",
    "examples_metadata": "https://tinyzkp.com/examples.json",
    "agent_policy": "https://tinyzkp.com/agent-policy",
    "agent_policy_metadata": "https://tinyzkp.com/agent-policy.json",
    "limits": "https://tinyzkp.com/limits",
    "limits_metadata": "https://tinyzkp.com/limits.json",
    "evaluation": "https://tinyzkp.com/evaluation",
    "evaluation_metadata": "https://tinyzkp.com/evaluation.json",
    "fit": "https://tinyzkp.com/fit",
    "fit_metadata": "https://tinyzkp.com/fit.json",
    "roi": "https://tinyzkp.com/roi",
    "roi_metadata": "https://tinyzkp.com/roi.json",
    "integrations": "https://tinyzkp.com/integrations",
    "integrations_metadata": "https://tinyzkp.com/integrations.json",
    "template_catalog": "https://tinyzkp.com/templates",
    "template_metadata": "https://tinyzkp.com/templates.json",
    "changelog": "https://tinyzkp.com/changelog",
    "changelog_metadata": "https://tinyzkp.com/changelog.json",
    "enterprise": "https://tinyzkp.com/enterprise",
    "enterprise_metadata": "https://tinyzkp.com/enterprise.json",
    "platform_rollout": "https://tinyzkp.com/platform-rollout",
    "platform_rollout_metadata": "https://tinyzkp.com/platform-rollout.json",
    "calculator": "https://tinyzkp.com/calculator",
    "calculator_metadata": "https://tinyzkp.com/calculator.json",
    "privacy_policy": "https://tinyzkp.com/privacy",
    "terms": "https://tinyzkp.com/terms",
    "pilot_program": "https://tinyzkp.com/pilot",
    "contact": "https://tinyzkp.com/contact",
    "docs": "https://tinyzkp.com/docs",
    "pricing_metadata": "https://tinyzkp.com/pricing.json",
    "openapi": "https://tinyzkp.com/openapi.json",
    "llms": "https://tinyzkp.com/llms.txt",
    "receipt_schema": "https://tinyzkp.com/schemas/tinyzkp-receipt.schema.json",
    "agent_receipt_schema": "https://tinyzkp.com/schemas/agent-receipt.schema.json"
  },
  "production_readiness_guidance": {
    "good_fit": [
      "Third-party verification of a state transition",
      "Verifier should not replay the source system",
      "Receipt can attach to an API response, audit record, agent output, or checkpoint",
      "Transparent public parameters are acceptable"
    ],
    "review_first": [
      "Private-input zero-knowledge requirement",
      "Custom predicate or unsupported state machine",
      "Contractual support targets or reserved capacity",
      "Special data-retention requirements",
      "On-chain or restricted-environment verifier requirement"
    ]
  }
}
